{
  "type": "aos.employer_brand_live_evidence_human_locator_review_pack",
  "schema_version": "2026-05-employer-brand-live-evidence-human-locator-review-pack-v0",
  "id": "live-evidence-human-locator-review-pack:symphony-talent-phenom-radancy",
  "label": "Symphony Talent Employer Brand Comparative Audit Project Human Locator Review Pack",
  "status": "human_locator_review_required",
  "source_refs": {
    "locator_resolution_result_path": "live-evidence-locator-resolution-result.json",
    "locator_readiness_path": "live-evidence-locator-readiness.json",
    "supervised_locator_plan_path": "live-evidence-supervised-locator-plan.json",
    "reviewed_target_plan_path": "live-evidence-target-plan.reviewed.json",
    "url_open_run_path": "live-evidence-url-open-run.json",
    "read_only_planning_evidence": true
  },
  "summary": {
    "review_item_count": 9,
    "ambiguous_locator_attempt_count": 7,
    "needs_human_target_review_count": 2,
    "locator_ready_count": 0,
    "expected_clip_count": 10,
    "source_counts": {
      "ambiguous_locator_attempt": 7,
      "needs_human_target_review": 2
    },
    "decision_status_counts": {
      "pending": 9
    },
    "unconfirmed_candidate_count": 7
  },
  "groups": [
    {
      "company": "Symphony Talent",
      "company_role": "client",
      "review_item_count": 3,
      "expected_clip_count": 4,
      "source_categories": [
        {
          "source_category": "careers_site",
          "review_item_count": 1,
          "expected_clip_count": 2,
          "review_items": [
            {
              "review_item_id": "human-locator-review-item:symphony-talent:careers-site",
              "target_id": "live-target:symphony-talent:careers-site",
              "work_unit_id": "live-locator-work-unit:symphony-talent:careers-site",
              "company": "Symphony Talent",
              "company_role": "client",
              "source_category": "careers_site",
              "url": "https://www.symphonytalent.com/",
              "final_url": "https://www.symphonytalent.com/",
              "page_name": "Symphony Talent Careers or jobs site",
              "desired_element": "Human-selected careers homepage hero or EVP proof block that states the employer promise without capturing the full page.",
              "evidence_goal": "Confirm Symphony Talent career-site positioning and visible employee value proposition proof for KILOS scoring.",
              "kilos_relevance": [
                "impact",
                "opportunity"
              ],
              "capture_type": "element_clip_and_text_extract",
              "expected_clip_count": 2,
              "acceptance_criteria": [
                "The captured evidence is scoped to one visible careers-site element, not the full page.",
                "The element includes enough surrounding heading or label text to understand the employer promise out of context.",
                "The element can be reviewed against Impact and Opportunity before capture execution."
              ],
              "review_source": "ambiguous_locator_attempt",
              "resolution_status": "ambiguous",
              "readiness_state": "needs_locator",
              "url_open_status": "reachable",
              "ambiguity_or_blocker_reason": "durable_url_open_run_has_no_dom_or_accessibility_snapshot_for_selector_confirmation",
              "unconfirmed_selector_candidates": [
                {
                  "selector": null,
                  "xpath": null,
                  "playwright_locator": null,
                  "selector_type": "unconfirmed_metadata_only",
                  "confidence": 0.1,
                  "rationale": "No selector can be confirmed from executed URL-open metadata alone: Symphony Talent / careers_site / reachable / Talent Acquisition Software | Recruitment CRM &amp; Marketing Solutions.",
                  "provenance": "durable_url_open_metadata_only",
                  "metadata_only": true
                }
              ],
              "human_locator": {
                "selector": null,
                "xpath": null,
                "playwright_locator": null
              },
              "locator_ready": false,
              "required_human_decision": {
                "status": "pending",
                "allowed_decisions": [
                  "approve_selector",
                  "edit_selector",
                  "provide_xpath",
                  "provide_playwright_locator",
                  "refine_natural_language_target",
                  "mark_blocked",
                  "keep_draft",
                  "reject_target"
                ],
                "selected_decision": null,
                "human_notes": null
              },
              "non_goal_flags": {
                "locator_execution": false,
                "codegen_execution": false,
                "url_opening": false,
                "screenshot_capture": false,
                "element_clip_generation": false,
                "capture_execution": false,
                "report_rendering": false,
                "export_execution": false,
                "workflow_engine": false,
                "full_page_grabs": false,
                "autonomous_crawling": false,
                "bypasses": false
              },
              "provenance": {
                "source_locator_resolution_result_id": "locator-resolution-result:symphony-talent:careers-site",
                "source_locator_readiness_target": "live-target:symphony-talent:careers-site",
                "source_supervised_locator_work_unit_id": "live-locator-work-unit:symphony-talent:careers-site",
                "metadata_only": true,
                "read_only_planning_evidence": true
              }
            }
          ]
        },
        {
          "source_category": "linkedin_presence",
          "review_item_count": 1,
          "expected_clip_count": 1,
          "review_items": [
            {
              "review_item_id": "human-locator-review-item:symphony-talent:linkedin-presence",
              "target_id": "live-target:symphony-talent:linkedin-presence",
              "work_unit_id": "live-locator-work-unit:symphony-talent:linkedin-presence",
              "company": "Symphony Talent",
              "company_role": "client",
              "source_category": "linkedin_presence",
              "url": "https://www.linkedin.com/company/symphony-talent/",
              "final_url": "https://www.linkedin.com/company/symphony-talent/",
              "page_name": "Symphony Talent LinkedIn company, life, and jobs presence",
              "desired_element": "Human-selected LinkedIn company, life, jobs, or post element that shows talent-facing positioning or hiring proof.",
              "evidence_goal": "Capture social proof, talent-facing positioning, and active hiring signals.",
              "kilos_relevance": [
                "status",
                "impact"
              ],
              "capture_type": "element_clip_and_text_extract",
              "expected_clip_count": 1,
              "acceptance_criteria": [
                "The captured evidence is scoped to the named element, not the full page.",
                "The element visibly supports the LinkedIn company, life, and jobs presence source category.",
                "The element preserves enough surrounding labels or headings to understand the evidence out of context.",
                "The element can be reviewed against the stated KILOS relevance before capture execution."
              ],
              "review_source": "ambiguous_locator_attempt",
              "resolution_status": "ambiguous",
              "readiness_state": "needs_locator",
              "url_open_status": "reachable",
              "ambiguity_or_blocker_reason": "durable_url_open_run_has_no_dom_or_accessibility_snapshot_for_selector_confirmation",
              "unconfirmed_selector_candidates": [
                {
                  "selector": null,
                  "xpath": null,
                  "playwright_locator": null,
                  "selector_type": "unconfirmed_metadata_only",
                  "confidence": 0.1,
                  "rationale": "No selector can be confirmed from executed URL-open metadata alone: Symphony Talent / linkedin_presence / reachable / Symphony Talent | LinkedIn.",
                  "provenance": "durable_url_open_metadata_only",
                  "metadata_only": true
                }
              ],
              "human_locator": {
                "selector": null,
                "xpath": null,
                "playwright_locator": null
              },
              "locator_ready": false,
              "required_human_decision": {
                "status": "pending",
                "allowed_decisions": [
                  "approve_selector",
                  "edit_selector",
                  "provide_xpath",
                  "provide_playwright_locator",
                  "refine_natural_language_target",
                  "mark_blocked",
                  "keep_draft",
                  "reject_target"
                ],
                "selected_decision": null,
                "human_notes": null
              },
              "non_goal_flags": {
                "locator_execution": false,
                "codegen_execution": false,
                "url_opening": false,
                "screenshot_capture": false,
                "element_clip_generation": false,
                "capture_execution": false,
                "report_rendering": false,
                "export_execution": false,
                "workflow_engine": false,
                "full_page_grabs": false,
                "autonomous_crawling": false,
                "bypasses": false
              },
              "provenance": {
                "source_locator_resolution_result_id": "locator-resolution-result:symphony-talent:linkedin-presence",